{
  "schemaVersion": 1,
  "lectureId": "020 Tape003-Side2-Ch2.mp3",
  "mode": "fill",
  "transcript": "transcripts/020%20Tape003-Side2-Ch2.mp3.json",
  "transcriptSha": "c53cf094deb274a4ad8e142e75a0c72b6427d160c5f689fa9a264f373a59aeab",
  "wordTimes": "sofer",
  "method": {
    "name": "audio-led-listener",
    "version": 1,
    "thresholds": {
      "burstHiDb": 14.0,
      "burstLoDb": 7.0,
      "burstMinPause": 0.1,
      "burstDur": [
        0.08,
        0.7
      ],
      "speaker": 0.1,
      "ctcRight": -1.0,
      "minSeeds": 30,
      "posFrameSpeaker": 0.15,
      "audioMinPosterior": 0.6,
      "residualSpeaker": 0.05,
      "residualMaxSeconds": 0.6,
      "residualMinCoreFrames": 5,
      "maxEditSeconds": 0.6,
      "corePosterior": 0.8,
      "coreDb": 20.0,
      "capTailFrames": 15,
      "padFrames": 2
    },
    "models": {
      "speaker": "speechbrain/spkrec-ecapa-voxceleb@0f99f2d0ebe8",
      "keywordCtc": "torchaudio MMS_FA (with <star>)",
      "keywordAsr": "Systran/faster-whisper-base@ebe41f70d5b6"
    },
    "pool": [
      "063 Ch5 part4.mp3",
      "002 Tape016-Side1-Ch10.mp3",
      "214 Tape46-Side1 Ch41&42.mp3"
    ]
  },
  "source": {
    "url": "https://media.shaarhayichudresources.com/Markel%20Advanced%20Compact%20Seminar/Advanced%20%20part%202%20ch%201%20-%204%20compact/020%20Tape003-Side2-Ch2.mp3",
    "sha256": "8a66d5c88702d1c8b9046e83333f441ba6f927d15d5079da85bcc666d0911842",
    "sampleRate": 16000,
    "channels": 1,
    "durationSeconds": 1706.731,
    "bitrate": 24000
  },
  "stats": {
    "bursts": 112,
    "transcriptRights": 37,
    "seeds": 14,
    "pooledSpeaker": true,
    "listenerBursts": 21,
    "posterior": {
      "posFrames": 670,
      "pooledPosFrames": 5774,
      "negFrames": 15574,
      "valTpr": 0.994,
      "valFpr": 0.006
    },
    "edits": 32,
    "isolated": 22,
    "overlap": 10,
    "editsPerHour": 67.5,
    "removedSeconds": 10.99,
    "seconds": 105.9
  },
  "edits": [
    {"start": 90.3, "end": 90.69, "class": "isolated", "action": "fill", "src": "audio", "scores": {"spk": 0.421, "P": 0.968, "ctcRight": -0.99, "whisper": "right."}},
    {"start": 113.49, "end": 113.87, "class": "isolated", "action": "fill", "src": "audio", "scores": {"spk": 0.359, "P": 0.953, "ctcRight": -0.43, "whisper": "Right."}},
    {"start": 116.82, "end": 117.27, "class": "isolated", "action": "fill", "src": "audio", "scores": {"spk": 0.346, "P": 0.991, "ctcRight": -1.3, "whisper": "Right."}},
    {"start": 154.0, "end": 154.43, "class": "isolated", "action": "fill", "src": "audio", "scores": {"spk": 0.345, "P": 0.9, "ctcRight": -1.32, "whisper": "the...  Right."}},
    {"start": 169.89, "end": 170.34, "class": "isolated", "action": "fill", "src": "audio", "scores": {"spk": 0.281, "P": 0.99, "ctcRight": -2.34, "whisper": "Right."}},
    {"start": 177.83, "end": 178.26, "class": "isolated", "action": "fill", "src": "audio", "scores": {"spk": 0.357, "P": 0.864, "ctcRight": -0.83, "whisper": "Right."}},
    {"start": 188.08, "end": 188.55, "class": "isolated", "action": "fill", "src": "audio", "scores": {"spk": 0.379, "P": 0.918, "ctcRight": -1.13, "whisper": "Right."}},
    {"start": 190.41, "end": 190.87, "class": "isolated", "action": "fill", "src": "audio", "scores": {"spk": 0.296, "P": 0.949, "ctcRight": -0.62, "whisper": "Right."}},
    {"start": 198.23, "end": 198.64, "class": "isolated", "action": "fill", "src": "tx", "scores": {"spk": 0.39, "P": 0.942}},
    {"start": 232.78, "end": 233.16, "class": "isolated", "action": "fill", "src": "audio", "scores": {"spk": 0.378, "P": 0.946, "ctcRight": -1.14, "whisper": "Right.", "cappedFrom": [232.77, 233.39]}},
    {"start": 242.26, "end": 242.74, "class": "isolated", "action": "fill", "src": "audio", "scores": {"spk": 0.338, "P": 0.927, "ctcRight": -3.34, "whisper": "right."}},
    {"start": 251.89, "end": 252.22, "class": "isolated", "action": "fill", "src": "audio", "scores": {"spk": 0.43, "P": 0.8, "ctcRight": -1.39, "whisper": "Right.  Yes,", "cappedFrom": [251.63, 252.31]}},
    {"start": 271.69, "end": 271.94, "class": "isolated", "action": "fill", "src": "tx", "scores": {"spk": 0.272, "P": 0.743}},
    {"start": 301.89, "end": 302.14, "class": "isolated", "action": "fill", "src": "audio+tx", "scores": {"spk": 0.395, "P": 0.811, "ctcRight": -2.65, "whisper": "Five."}},
    {"start": 339.46, "end": 339.82, "class": "isolated", "action": "fill", "src": "tx", "scores": {"spk": 0.457, "P": 0.842}},
    {"start": 345.24, "end": 345.65, "class": "isolated", "action": "fill", "src": "audio", "scores": {"spk": 0.215, "P": 0.887, "ctcRight": -0.61, "whisper": "five."}},
    {"start": 374.16, "end": 374.39, "class": "overlap", "action": "partial-fill", "src": "tx", "scores": {"spk": 0.168, "P": 0.933}},
    {"start": 381.43, "end": 381.6, "class": "overlap", "action": "partial-fill", "src": "tx", "scores": {"spk": 0.146, "P": 0.794}},
    {"start": 420.32, "end": 420.55, "class": "overlap", "action": "partial-fill", "src": "tx", "scores": {"spk": 0.211, "P": 0.843}},
    {"start": 424.98, "end": 425.19, "class": "overlap", "action": "partial-fill", "src": "tx", "scores": {"spk": 0.383, "P": 0.845}},
    {"start": 434.74, "end": 435.02, "class": "overlap", "action": "partial-fill", "src": "tx", "scores": {"spk": 0.253, "P": 0.78}},
    {"start": 470.63, "end": 470.89, "class": "overlap", "action": "partial-fill", "src": "tx", "scores": {"spk": 0.31, "P": 0.79}},
    {"start": 500.8, "end": 501.03, "class": "overlap", "action": "partial-fill", "src": "tx", "scores": {"spk": 0.199, "P": 0.806}},
    {"start": 575.35, "end": 575.61, "class": "isolated", "action": "fill", "src": "audio", "scores": {"spk": 0.184, "P": 0.815, "ctcRight": -3.18, "whisper": "Right."}},
    {"start": 889.19, "end": 889.48, "class": "isolated", "action": "fill", "src": "audio", "scores": {"spk": 0.261, "P": 0.765, "ctcRight": -1.86, "whisper": "Right.  Right."}},
    {"start": 906.57, "end": 906.73, "class": "overlap", "action": "partial-fill", "src": "tx", "scores": {"spk": 0.235, "P": 0.798}},
    {"start": 917.37, "end": 917.67, "class": "isolated", "action": "fill", "src": "tx", "scores": {"spk": 0.365, "P": 0.765}},
    {"start": 945.82, "end": 946.13, "class": "overlap", "action": "partial-fill", "src": "tx", "scores": {"spk": 0.133, "P": 0.897}},
    {"start": 951.95, "end": 952.31, "class": "isolated", "action": "fill", "src": "audio", "scores": {"spk": 0.45, "P": 0.977, "ctcRight": -1.3, "whisper": "Right.", "cappedFrom": [951.94, 952.59]}},
    {"start": 972.75, "end": 973.31, "class": "isolated", "action": "fill", "src": "audio", "scores": {"spk": 0.459, "P": 0.925, "ctcRight": -1.82, "whisper": "Right."}},
    {"start": 977.48, "end": 978.03, "class": "isolated", "action": "fill", "src": "audio", "scores": {"spk": 0.349, "P": 0.934, "ctcRight": -2.34, "whisper": "Right."}},
    {"start": 1001.35, "end": 1001.61, "class": "overlap", "action": "partial-fill", "src": "tx", "scores": {"spk": 0.247, "P": 0.701}}
  ],
  "kept": [
    {"start": 4.86, "end": 5.19, "reason": "audio:low-P:? heard 'Yeah.'"},
    {"start": 60.6, "end": 60.77, "reason": "tx:tx-lowspk:overlap"},
    {"start": 162.74, "end": 162.74, "reason": "tx:unlocalized:?"},
    {"start": 513.92, "end": 515.94, "reason": "tx:unlocalized:?"},
    {"start": 514.53, "end": 514.77, "reason": "audio:low-P:? heard 'white.'"},
    {"start": 526.17, "end": 526.42, "reason": "tx:tx-lowspk:overlap"},
    {"start": 921.88, "end": 924.6, "reason": "tx:unlocalized:?"},
    {"start": 1012.9, "end": 1013.33, "reason": "audio:low-P:?"},
    {"start": 1013.13, "end": 1013.33, "reason": "tx:tx-lowspk:overlap"}
  ],
  "output": {
    "filename": "020 Tape003-Side2-Ch2 (edited).mp3",
    "sha256": "876db7f88f5cfa110f3ad86a9180cb5930c9991b714788f0a3e5bf53f34dcd40",
    "bytes": 6827404,
    "durationSeconds": 1706.76,
    "bitrate": 32000,
    "sampleRate": 16000,
    "channels": 1,
    "encoder": "libmp3lame via ffmpeg version 6.1.1-3ubuntu5, CBR",
    "editsSha": "3e101e1df926ed5616ec049c1eff72ce79f543dd45ab136a895bf9dc1d4589fd",
    "toneFrom": {
      "same pause": 23,
      "nearby": 9
    },
    "verify": {
      "samples": 27307008,
      "samplesOut": 27307008,
      "lengthDiff": 0,
      "lags": [
        0,
        0,
        0,
        0,
        0
      ],
      "maxZeroRunInEdits": 0,
      "snrOutsideDb": 23.0,
      "ok": true,
      "durationDiffSeconds": 0.029
    }
  }
}
